{
  "$schema": "https://json-schema.org/draft/2020-12/schema",
  "$id": "https://fluencytracr.local/schemas/ai-value-intelligence/roi-scenario.schema.json",
  "title": "AI Value Governed ROI Scenario",
  "description": "Docs-backed local schema for governed ROI/value scenario modeling. This is not a production API contract and does not authorize customer-facing economic output.",
  "type": "object",
  "additionalProperties": true,
  "required": [
    "schema_version",
    "roi_scenario_id",
    "source_refs",
    "workflow",
    "evidence_status",
    "baseline_comparison",
    "metric_models",
    "customer_owned_assumptions",
    "scenario_bands",
    "safe_value_language",
    "economic_output_policy",
    "governance_boundaries"
  ],
  "properties": {
    "schema_version": {
      "const": "FT_AI_VALUE_ROI_SCENARIO_2026_06"
    },
    "roi_scenario_id": {
      "type": "string"
    },
    "source_refs": {
      "type": "object",
      "additionalProperties": true,
      "required": [
        "blueprint_id",
        "metrics_library_id",
        "value_scenario_id",
        "readiness_id"
      ],
      "properties": {
        "blueprint_id": { "type": "string" },
        "metrics_library_id": { "type": "string" },
        "value_scenario_id": { "type": "string" },
        "readiness_id": { "type": "string" }
      }
    },
    "workflow": {
      "type": "object",
      "additionalProperties": false,
      "required": ["workflow_family", "workflow_name", "value_route"],
      "properties": {
        "workflow_family": { "type": "string" },
        "workflow_name": { "type": "string" },
        "value_route": {
          "enum": [
            "COST_REDUCTION",
            "CAPACITY_CREATION",
            "QUALITY_IMPROVEMENT",
            "RISK_REDUCTION",
            "EXPERIENCE_IMPROVEMENT",
            "REVENUE_EXPANSION",
            "UNCLASSIFIED"
          ]
        }
      }
    },
    "evidence_status": {
      "type": "object",
      "additionalProperties": false,
      "required": [
        "readiness_decision",
        "outcome_evidence_review_state",
        "source_coverage"
      ],
      "properties": {
        "readiness_decision": {
          "enum": [
            "READY_FOR_EXECUTIVE_VALIDATION",
            "HOLD_FOR_ASSUMPTIONS",
            "HOLD_FOR_SOURCE_COVERAGE",
            "HOLD_FOR_BASELINE",
            "STOP_FOR_GOVERNANCE_REVIEW"
          ]
        },
        "outcome_evidence_review_state": {
          "enum": ["ACCEPTED", "SUBMITTED", "REJECTED", "MISSING"]
        },
        "source_coverage": {
          "type": "object",
          "additionalProperties": false,
          "required": [
            "ai_activity",
            "workflow",
            "outcome",
            "baseline",
            "trust",
            "assumptions",
            "suppression"
          ],
          "properties": {
            "ai_activity": { "$ref": "#/$defs/state" },
            "workflow": { "$ref": "#/$defs/state" },
            "outcome": { "$ref": "#/$defs/state" },
            "baseline": { "$ref": "#/$defs/state" },
            "trust": { "$ref": "#/$defs/state" },
            "assumptions": { "$ref": "#/$defs/state" },
            "suppression": { "$ref": "#/$defs/state" }
          }
        }
      }
    },
    "baseline_comparison": {
      "type": "object",
      "additionalProperties": false,
      "required": ["baseline_window", "comparison_window"],
      "properties": {
        "baseline_window": { "$ref": "#/$defs/window" },
        "comparison_window": { "$ref": "#/$defs/window" }
      }
    },
    "metric_models": {
      "type": "array",
      "minItems": 1,
      "items": {
        "type": "object",
        "additionalProperties": true,
        "required": [
          "metric_id",
          "name",
          "value_route",
          "measurement_unit",
          "source_system",
          "baseline_rule",
          "comparison_rule",
          "formula_template",
          "allowed_claim_level",
          "value_model_role"
        ],
        "properties": {
          "metric_id": { "type": "string" },
          "name": { "type": "string" },
          "value_route": { "type": "string" },
          "measurement_unit": { "type": "string" },
          "source_system": { "type": "object" },
          "baseline_rule": { "type": "string" },
          "comparison_rule": { "type": "string" },
          "formula_template": { "type": "string" },
          "allowed_claim_level": {
            "enum": [
              "CAVEATED_VALUE_INVESTIGATION",
              "SOURCE_READINESS_ONLY",
              "INTERNAL_ONLY",
              "BLOCKED"
            ]
          },
          "value_model_role": {
            "enum": ["PRIMARY", "CONTEXT", "GUARDRAIL"]
          }
        }
      }
    },
    "customer_owned_assumptions": {
      "type": "array",
      "minItems": 1,
      "items": {
        "type": "object",
        "additionalProperties": true,
        "required": ["assumption_id", "state", "owner"],
        "properties": {
          "assumption_id": { "type": "string" },
          "state": { "$ref": "#/$defs/state" },
          "owner": { "type": "string" }
        }
      }
    },
    "scenario_bands": {
      "type": "array",
      "minItems": 3,
      "items": {
        "type": "object",
        "additionalProperties": true,
        "required": ["band", "interpretation", "included_metric_ids"],
        "properties": {
          "band": {
            "enum": ["CONSERVATIVE", "BASE_CASE", "EXPANDED"]
          },
          "interpretation": { "type": "string" },
          "included_metric_ids": {
            "type": "array",
            "minItems": 1,
            "items": { "type": "string" }
          }
        }
      }
    },
    "safe_value_language": {
      "type": "object",
      "additionalProperties": false,
      "required": [
        "allowed_claim_level",
        "allowed_phrases",
        "required_caveats",
        "blocked_claims"
      ],
      "properties": {
        "allowed_claim_level": {
          "enum": [
            "CAVEATED_VALUE_INVESTIGATION",
            "SOURCE_READINESS_ONLY",
            "INTERNAL_ONLY",
            "BLOCKED"
          ]
        },
        "allowed_phrases": {
          "type": "array",
          "minItems": 1,
          "items": { "type": "string" }
        },
        "required_caveats": {
          "type": "array",
          "minItems": 1,
          "items": { "type": "string" }
        },
        "blocked_claims": {
          "type": "array",
          "items": { "$ref": "#/$defs/blocked_claim" }
        }
      }
    },
    "economic_output_policy": {
      "type": "object",
      "additionalProperties": false,
      "required": [
        "mode",
        "customer_facing_economic_output",
        "dollarized_output",
        "realized_roi_calculation"
      ],
      "properties": {
        "mode": {
          "enum": ["MODELED_RANGE_ONLY", "VALUE_HYPOTHESIS_ONLY", "BLOCKED"]
        },
        "customer_facing_economic_output": { "type": "boolean" },
        "dollarized_output": { "type": "boolean" },
        "realized_roi_calculation": { "type": "boolean" }
      }
    },
    "financial_claim_gate": {
      "type": "object",
      "additionalProperties": false,
      "required": ["mode", "data_sufficiency", "allowed_outputs"],
      "properties": {
        "mode": {
          "enum": [
            "BLOCKED",
            "INTERNAL_MODELING",
            "EXECUTIVE_CAVEATED",
            "FINANCE_VALIDATED",
            "CUSTOMER_FACING_APPROVED"
          ]
        },
        "data_sufficiency": {
          "type": "object",
          "additionalProperties": false,
          "required": [
            "aggregate_only",
            "baseline_present",
            "comparison_present",
            "outcome_metric_accepted",
            "financial_assumptions_present",
            "investment_costs_present",
            "finance_owner_attested",
            "confounds_reviewed"
          ],
          "properties": {
            "aggregate_only": { "type": "boolean" },
            "baseline_present": { "type": "boolean" },
            "comparison_present": { "type": "boolean" },
            "outcome_metric_accepted": { "type": "boolean" },
            "financial_assumptions_present": { "type": "boolean" },
            "investment_costs_present": { "type": "boolean" },
            "finance_owner_attested": { "type": "boolean" },
            "confounds_reviewed": { "type": "boolean" },
            "legal_or_governance_approved": { "type": "boolean" },
            "experimental_or_quasi_experimental_design": { "type": "boolean" }
          }
        },
        "allowed_outputs": {
          "type": "object",
          "additionalProperties": false,
          "required": [
            "dollarized_output",
            "realized_roi_calculation",
            "customer_facing_economic_output",
            "causality_language",
            "aggregate_workflow_productivity"
          ],
          "properties": {
            "dollarized_output": { "type": "boolean" },
            "realized_roi_calculation": { "type": "boolean" },
            "customer_facing_economic_output": { "type": "boolean" },
            "causality_language": { "type": "boolean" },
            "aggregate_workflow_productivity": { "type": "boolean" }
          }
        }
      }
    },
    "workforce_analytics_gate": {
      "type": "object",
      "additionalProperties": false,
      "required": [
        "mode",
        "aggregate_only",
        "minimum_cohort_size_met",
        "no_direct_identifiers",
        "no_person_level_hris_records",
        "no_hashed_or_joinable_person_identifiers",
        "no_person_level_productivity",
        "no_manager_ranking",
        "no_individual_decisioning",
        "no_people_decisioning",
        "no_compensation_or_performance_inference",
        "no_hris_inference_from_ai_usage",
        "no_sensitive_attribute_inference",
        "hris_join_allowed",
        "allowed_outputs"
      ],
      "properties": {
        "mode": {
          "enum": [
            "BLOCKED",
            "AGGREGATE_INTERNAL",
            "EXECUTIVE_CAVEATED",
            "FINANCE_OR_HR_ATTESTED"
          ]
        },
        "aggregate_only": { "type": "boolean" },
        "minimum_cohort_size_met": { "type": "boolean" },
        "no_direct_identifiers": { "type": "boolean" },
        "no_person_level_hris_records": { "type": "boolean" },
        "no_hashed_or_joinable_person_identifiers": { "type": "boolean" },
        "no_person_level_productivity": { "type": "boolean" },
        "no_manager_ranking": { "type": "boolean" },
        "no_individual_decisioning": { "type": "boolean" },
        "no_people_decisioning": { "type": "boolean" },
        "no_compensation_or_performance_inference": { "type": "boolean" },
        "no_hris_inference_from_ai_usage": { "type": "boolean" },
        "no_sensitive_attribute_inference": { "type": "boolean" },
        "hris_join_allowed": { "const": false },
        "allowed_outputs": {
          "type": "object",
          "additionalProperties": false,
          "required": [
            "aggregate_workforce_readiness",
            "aggregate_enablement_coverage",
            "aggregate_training_completion",
            "aggregate_ai_confidence",
            "aggregate_change_readiness",
            "aggregate_workflow_capacity",
            "aggregate_role_family_adoption"
          ],
          "properties": {
            "aggregate_workforce_context": { "type": "boolean" },
            "aggregate_hris_derived_context": { "type": "boolean" },
            "aggregate_role_family_context": { "type": "boolean" },
            "aggregate_new_hire_cohort_context": { "type": "boolean" },
            "aggregate_training_completion_context": { "type": "boolean" },
            "aggregate_capacity_planning_context": { "type": "boolean" },
            "aggregate_workforce_readiness": { "type": "boolean" },
            "aggregate_enablement_coverage": { "type": "boolean" },
            "aggregate_training_completion": { "type": "boolean" },
            "aggregate_ai_confidence": { "type": "boolean" },
            "aggregate_change_readiness": { "type": "boolean" },
            "aggregate_workflow_capacity": { "type": "boolean" },
            "aggregate_role_family_adoption": { "type": "boolean" }
          }
        }
      }
    },
    "governance_boundaries": {
      "type": "object",
      "additionalProperties": false,
      "properties": {
        "production_connector": { "const": false },
        "dashboard": { "const": false },
        "realized_roi_calculation": { "const": false },
        "causality_claim": { "const": false },
        "individual_scoring": { "const": false },
        "named_employee_productivity": { "const": false },
        "individual_productivity_measurement": { "const": false },
        "team_or_manager_ranking": { "const": false },
        "hris_or_people_analytics": { "const": false },
        "people_decisioning": { "const": false },
        "compensation_or_performance_inference": { "const": false },
        "hris_inference": { "const": false },
        "productivity_ranking": { "const": false },
        "raw_prompt_or_response_storage": { "const": false },
        "raw_content_storage": { "const": false },
        "direct_identifiers": { "const": false },
        "runtime_service": { "const": false },
        "autonomous_customer_actions": { "const": false },
        "customer_facing_economic_output": { "const": false }
      }
    }
  },
  "$defs": {
    "state": {
      "enum": ["PRESENT", "CAVEATED", "MISSING", "SUPPRESSED", "BLOCKED"]
    },
    "window": {
      "type": "object",
      "additionalProperties": true,
      "required": ["state", "owner", "rule"],
      "properties": {
        "state": { "$ref": "#/$defs/state" },
        "owner": { "type": "string" },
        "rule": { "type": "string" }
      }
    },
    "blocked_claim": {
      "enum": [
        "roi_proof",
        "causality_claim",
        "individual_scoring",
        "named_employee_productivity",
        "individual_productivity_measurement",
        "team_or_manager_ranking",
        "hr_analytics",
        "people_decisioning",
        "compensation_or_performance_inference",
        "hris_inference",
        "productivity_measurement",
        "productivity_ranking",
        "raw_prompt_or_response_storage",
        "direct_identifiers",
        "raw_content_storage",
        "realized_roi_calculation",
        "customer_facing_economic_output"
      ]
    }
  }
}
